flower_name,desc,arial,eco,resursi
ВОДОСБОР ОБЫКНОВЕННЫЙ ,"Описание. Многолетнее, голое травянистое расте - ние с коротким и относительно толстым корневищем. Стебли прямостоячие, высотой 30-80 см, ветвящиеся и железистоволосистые в верхней части. Прикорневые листья дважды-тройчатосложные. Листья черешковые, дважды-трехраздельные с трехлопастными, по краям зазубренными или цельнокрайними листочками. Цвет - ки диаметром 4-5 см, с 5 чашелистиками и 5 лепест - ками, одиночные, поникающие, на длинных ножках, выходящих из пазух верхних листьев. Чашелистики широкояйцевидные, окрашенные аналогично венчику. Лепестки косоворонковидные, при основании сужен - ные в шпорец, синие, лиловые, реже розовые или бе - лые. Шпорцы крючковидные, вдвое длиннее отгибов. Тычинки многочисленные, не выступающие из около - цветника. Пестиков 5. Между тычинками и пестиками расположены пленчатые стаминодии. Плод – пятили - стовка длиной около 2,5 см. Семена мелкие черные. Цветет в мае-августе. Диплоидный набор хромосом 2n =14. В медицине используется надземная часть (трава) водосбора обыкновенного.","Ареал. Встречается по всей европейской части России, включая Крым, кроме северных и восточных районов. Культивируется во всех регионах России как декоративное растение. Нередко дичает.",,
ВОЛОДУШКА ЗОЛОТИСТАЯ,"Описание. Короткокорневищное многолет - нее поликарпическое растение. Корневища тонкие, темно-коричневые, ползучие, слаборазветвлённые. Побеги голые, сизые, обычно одиночные (иногда в числе 2-3), в верхней части слабо ветвистые, вы - сотой 25-150 см; прикорневые и частично нижние стеблевые листья продолговато-обратнояйцевидные или широкоэллиптические, к основанию суженные в довольно узкий и длинный черешок, туповатые, до 20 см длиной (с черешком) и 3-6 см шириной; сред - ние стеблевые листья пронзенные, сидячие, от поч - ти обратнояйцевидных до продолговато-яйцевидных или яйцевидных, туповато-заостренные, в основании с крупными ушками, или сердцевидные, почти сте - блеобъемлющие, 5-15 см длиной и 2-7 см шириной; верхние стеблевые – более мелкие и относительно более широкие (широкояйцевидные или почти окру - глые), самые верхние обычно желтоватые. Зонтики крупные, немногочисленные; осевые – с 5-10 (20) прямыми или дуговидно изогнутыми, до - вольно тонкими лучами длиной до 57 см; обертки из 3-5 крупных, обычно широко и неправильно яйце - видных, неравных листочков длиной 1-3,5 см, сход - ных с верхними листьями; оберточки из 5 (8) яйце - видных, эллиптических или почти округлых, на вер - хушке короткозаостренных или тупых, тонких плен - чатых листочков, ярко-желтых или зеленых, почти равные или значительно длиннее зонтичков. Цветки по 15-20 в зонтичке, на довольно длин - ных (2-5 мм) цветоножках, лепестки желтые, об - ратнояйцевидные, на верхушке цельные, загнутые внутрь, гипостиль низкоконический или дискоид - ный, бледно-желтый; гинецей синкарпный. Плоды – продолговато-эллиптические темнокоричневые вис - лоплодники, длиной до 4 (6) мм, с 4 продолговатыми бороздками, распадающиеся на два мерикарпия. В отечественной научной литературе володу - шка золотистая обычно указывается, как подвид володушки длиннолистной – Bupleurum longifolium subsp. aureum (Fisch.) Soó, но согласно современной международной ботанической номенклатуры (база данных The Plant List (theplatlist.org) она выделяется в отдельный вид Bupleurum aureum Fisch. ex Hoffm. Цветет июне-июле, плодоносит в августе-сентя - бре. Диплоидный набор хромосом 2n=16. Лекарственным сырьем володушки золотистой является трава.","Ареал. На территории России володушка зо - лотистая растет в Европейской части страны (преи - мущественно северные районы Нечерноземья, По -волжье), на Урале, в Западной и Восточной Сибири. Володушка золотистая (указанная как подвид воло - душки длиннолистной B. longifolium subsp. aureum (Fisch.) Soó) охраняется в ряде субъектов Российской Федерации. За пределами России распространена в Европе, Средней Азии (Казахстан, Кыргызстан), Китае (За - падный Синьцзян) и Монголии.","Экология. Володушка золотистая растет пре - имущественно по открытым светлым лесам (в рав - нинных регионах), среди кустарников, на полях и на горных склонах (на высотах до 1300—1900 м над уровнем моря) и по берегам рек в составе лугово - го разнотравья.",
ГАМАМЕЛИС ВИРГИНСКИЙ,"Описание. Кустарник, полукустарник высотой 2-9 м. Молодые побеги опушенные, впоследствии го - лые, желто-бурые. Кора ствола и ветвей светло-серая. Листья очередные, короткочерешковые, длиной 8-15 см, и шириной 5-8 см, обратнояйцевидные или широкоэл - липтические, асимметричные, у основания слабояйце - видные или клиновидные, городчато-зубчатые, сверху голые, снизу, в молодом возрасте, на черешке и жилках заметны рыжие звездчатые волоски. Прилистники опа - дают быстро. Цветки обоеполые, реже однополые, аро - матные, скученные по 2-5 на поникающих пазушных цветоносах. Четыре лепестка ярко-желтого цвета, лен - товидные, длиной 1,5-2 см и в несколько раз превыша - ющие длину чашелистиков. В бутоне свернуты в виде пружинки. Тычинок 4, с короткими нитями и почти шаровидными пыльниками. С тычинками чередуются 4 коротких и плоских стаминодия. Пестик с двугнезд - ной завязью, двумя короткими столбиками и туповатым рыльцем. Одновременно в период осеннего цветения со - зревают плоды, завязавшиеся в предшествующем году. Плод – широкоэллиптическая двусемянная коро - бочка длиной 1-1,5 см, примерно до середины окруже - на разрастающейся чашечкой, а на конце с 4 короткими крючкообразными отростками. При созревании коро - бочка растрескивается на верхушке и семена разлета - ются в разные стороны. Семена продолговатые, с одной стороны почти плоские, черные, с плотной блестящей оболочкой. Масса 1000 шт. – 40 г. Цветет с конца сентя - бря до декабря (в Южной Европе) в период или после опадения листьев, плоды созревают весной-летом сле - дующего года. Зимует в кустарниковой форме в районе Москвы и Санкт-Петербурга, цветет, но не плодоносит. У гамамелиса виргинского весьма необычное для умеренного климата одновременное проявление осен - них и весенних фаз развития, то есть проявляется несо - ответствие некоторых фаз сезонным ритмам. Эмбрио - нальное развитие цветочной почки происходит в теплое время года, а цветение и первые этапы развития плода совпадают с холодными месяцами. В Московском регионе начало весеннего распуска - ния почек – в начале 3 декады апреля, цветение – в сен - тябре-январе последующего года, созревание семян, завязавшихся в предыдущем году – в сентябре-октябре. Диплоидный набор хромосом 2n=24. Лекарственным растительным сырьем являются листья и кора растения. Другие виды. Гамамелис мягкий Hamamelis mollis Oliv.ex F.B.Forbes & Hemsl. – реликтовый вид, эндемик южного Китая. Это дерево или древовидный кустарник высотой до 8 м, выращивают как декоративное расте - ние. Отличается от г. виргинского обильным опушени -ем. Листья г. мягкого используют для получения экс - тракта, обладающего антирадикальной активностью. Гамамелис средний Hamamelis x intermedia Rehder возник как спонтанный гибрид между гамамелисом японским и г. мягким в 1930-х годах. Существует много сортов: с лимонно-желтыми, золотисто-желтыми, яр - ко-желтыми, оранжевыми и медно-красными цветками разных размеров (от мелких до крупных), приятным ароматом, красивыми красными и оранжевыми оттен - ками осенних листьев, разным габитусом растений. Г. средний и г. мягкий используют для озеленения.",Ареал. Родина гамамелиса — Атлантическое по - бережье Северной Америки. В естественных условиях его дикие заросли находятся в южной и восточной ча - сти США от штатов Техас и Джорджия до Великих Озер и Канады . В Европу был завезен английским ботаником Кол - линсоном в 1736 году. Как декоративное растение вы - ращивается во многих странах с умеренным климатом. Очень популярен в Европе при озеленении парков.,,
ГАРМАЛА ОБЫКНОВЕННАЯ ,,,,
ГОРЕЦ ЗМЕИНЫЙ,,,,
ГОРЕЦ ПЕРЕЧНЫЙ,"Описание. Однолетнее травянистое растение с прямостоячим, обычно красноватым, ветвистым сте - блем, высотой 30-60 см. Корни сравнительно короткие, маловетвистые. Листья очередные, ланцетовидные, за - остренные, с узкоклиновидным основанием, нижние короткочерешковые, верхние почти сидячие, по краю с короткими жесткими ресничками, слегка волнистые. Раструбы цилиндрические, пленчатые, красноватые, на поверхности голые, по краю с короткими ресничка - ми или без них. Цветки на концах побегов, сидячие, по 1-3 в пазу - хах листьев, образуют негустые, длинные, тонкие, нередко прерывистые, с поникающей верхушкой со - цветия. Околоцветник длиной 3-4 мм, обычно че - тырехраздельный (реже трех-пятираздельный), зе - леноватый или розоватый, снаружи густо усеянный золотисто-желтыми точечными железками. Тычинок 3-8, плоды — яйцевидные орешки, 2,5–3,5 мм длиной, 1,5–2 мм шириной, 0,8–1,5 мм толщиной, немного ко - роче околоцветника, с одной стороны плоские, с дру - гой — выпуклые, с тусклой мелкозернистой поверх - ностью. Плоды заостренные, трех- двугранные. У дву - гранных плодов обе стороны выпуклые (линзовид - ные), или одна сторона более выпуклая и образует ши - рокую крышу. Кончик острый с перистым придатком. У рубчикового конца часто расположен остаток около - цветника. Поверхность темно-коричневая или корич - нево-черная. Цветет и плодоносит с июня по октябрь, в Запад - ной Сибири — с середины июня до сентября. Диплоидный набор хромосом 2 n=18, 22, 30. Секвенирование ДНК генома хлоропластов позволило уточнить таксономическую принадлежность вида вну - три рода Persicaria : он отнесён к секции Eupersicaria . Лекарственным растительным сырьем является надземная часть (трава) горца перечного. Близкие виды . Горец мягкий — P . mit is (Schrank) Holub , отличается от P . hydropiper приподнимающи - мися или восходящими стеблями высотой 15-30 см, с тонкими ветвями; листьями — продолговато-лан - цетовидными, с выступающими боковыми жилками, красноватым околоцветником без железок. Горец малый — Р. minus (Huds.) Opiz имеет лежа - чие или восходящие, реже прямостоячие разветвлен - ные стебли, линейные или линейно-ланцетовидные листья, с неясно выраженными боковыми жилками.","Ареал. Горец перечный — голарктический вид, широко распространен почти во всей европейской ча - сти России (за исключением Крайнего Севера), на Кав - казе, в Западной и Восточной Сибири, в южных рай - онах Дальнего Востока. В Якутии, на Камчатке и на Охотском побережье отсутствует. Северная граница ареала проходит примерно по 65°с.ш. на территории республики Карелия и по долине р. Кемь достигает Белого моря, южной части Соловецких о-вов, Архан - гельска. Затем, по долине Северной Двины опускает - ся к югу, севернее Котласа поворачивает на восток, пересекая около 55°в.д. бассейн Печоры, Северный Урал и, приблизительно на 61°с.ш., выходит на тер - риторию Сибири. Здесь она проходит через бассейн Конды, близ устья Иртыша пересекает Обь (около 71°в.д.) и по долине р. Кеть уходит в Красноярский край. Около Енисейска пересекает Енисей и следует далее к Киренску на Лене. Затем, огибая северную оконечность Байкала, идет через верховья р. Витим к р. Шилке, пересекает ее, выходит в долину Амура и следует по нему до Комсомольска-на-Амуре. Не - сколько местонахождений P . hydropiper отмечено так - же на Сахалине и на Курилах. Далее ареал горца перечного уходит за пределы территории России в Китай, Монголию, Казахстан. С территории Казахстана он опять поворачивает на север на территорию РФ к Челябинску, затем – на юг и восточнее Магнитогорска пересекает р. Урал. По до - лине этой реки граница ареала проходит до г. Ураль - ска и примерно по той же широте идет к Волге и спу - скается по ее долине до Астрахани. Далее на запад южная граница идет по побережью Каспийского моря до правого борта долины Волги. Снова поднимается до Волгограда, подходит к долине Дона (восточнее Ростова-на-Дону), затем языком окаймляет предгорья Северного Кавказа, далее к западу и на западе ареал уходит за пределы государственной границы Россий - ской Федерации. P . hydropiper распространен по всему миру и найден в умеренной и тропической Азии, вклю - чая Западную, Восточную и Среднюю Азию; Китае, Индии, Индокитае и Малайзии; в Европейском ре - гионе встречается в Северной, Средней, Восточной, Юго-Восточной и Юго-Западной Европе; обнаружен в Северной Африке и Австралии.","Экология. Горец перечный – влаголюбивое рас - тение, обитает преимущественно в лесной зоне, но по долинам рек заходит в степную и полупустынную зоны. Произрастает в поймах рек, на заболоченных местах, по сырым лугам, уремам, топким берегам рек, озер, прудов, стариц, вдоль сырых дорог и арыков. Часто, как сорное растение, встречается на сырых по - чвах орошаемых полей и в населенных пунктах, вдоль канав, около прудов.",
